{
  "schema_version": "1.0.0",
  "as_of": "2026-10-15",
  "overall_status": "ok",
  "series": {
    "usd_mxn_fix": {
      "pair": "USD-MXN",
      "label": "Tipo de cambio FIX (fecha de determinación)",
      "quote_unit": "MXN por 1 USD",
      "date_basis": "determinacion",
      "primary": true,
      "decimals": 4,
      "source": {
        "provider": "banxico",
        "institution": "Banco de México",
        "country": "MX",
        "series_id": "SF43718",
        "docs_url": "https://www.banxico.org.mx/SieAPIRest/service/v1/"
      },
      "method": "official",
      "value": 18.425,
      "date": "2026-10-15",
      "days_since_official": 0,
      "prev_value": 18.4888,
      "prev_date": "2026-10-14",
      "change_abs": -0.0638,
      "change_pct": -0.3451,
      "status": "ok"
    },
    "usd_mxn_liq": {
      "pair": "USD-MXN",
      "label": "Tipo de cambio FIX para pagos (fecha de liquidación, FIX de 2 días hábiles antes)",
      "quote_unit": "MXN por 1 USD",
      "date_basis": "vigencia",
      "primary": false,
      "decimals": 4,
      "source": {
        "provider": "banxico",
        "institution": "Banco de México",
        "country": "MX",
        "series_id": "SF60653",
        "docs_url": "https://www.banxico.org.mx/SieAPIRest/service/v1/"
      },
      "method": "official",
      "value": 18.3528,
      "date": "2026-10-15",
      "days_since_official": 0,
      "prev_value": 18.2542,
      "prev_date": "2026-10-14",
      "change_abs": 0.0986,
      "change_pct": 0.5401,
      "next": {
        "date": "2026-10-16",
        "value": 18.4888
      },
      "status": "ok"
    },
    "usd_cop_trm": {
      "pair": "USD-COP",
      "label": "Tasa Representativa del Mercado (TRM)",
      "quote_unit": "COP por 1 USD",
      "date_basis": "vigencia",
      "primary": true,
      "decimals": 2,
      "source": {
        "provider": "banrep",
        "institution": "Banco de la República (BanRep)",
        "country": "CO",
        "series_id": "DF_TRM_DAILY_HIST",
        "docs_url": "https://suameca.banrep.gov.co/estadisticas-economicas/",
        "authority": "Banco de la República: autoridad cambiaria que define la TRM y su metodología",
        "certified_by": "Superintendencia Financiera de Colombia (calcula y certifica la TRM a diario)",
        "legal_basis": "Res. Externa 1 de 2018 JDBR, art. 40; Circular Reglamentaria DODM-146",
        "verified_against": {
          "provider": "sfc_trm",
          "institution": "Superintendencia Financiera de Colombia (portal de datos abiertos datos.gov.co)",
          "series_id": "32sa-8pi3",
          "docs_url": "https://dev.socrata.com/foundry/www.datos.gov.co/32sa-8pi3"
        },
        "fallback_used": false
      },
      "method": "official",
      "value": 3197.65,
      "date": "2026-10-15",
      "days_since_official": 0,
      "prev_value": 3181.74,
      "prev_date": "2026-10-14",
      "change_abs": 15.91,
      "change_pct": 0.5,
      "next": {
        "date": "2026-10-16",
        "value": 3170.46
      },
      "status": "ok"
    },
    "usd_cop_trm_mkt": {
      "pair": "USD-COP",
      "label": "TRM por fecha de mercado (insumo de la cruzada)",
      "quote_unit": "COP por 1 USD",
      "date_basis": "determinacion",
      "primary": false,
      "decimals": 2,
      "source": {
        "provider": "banrep",
        "institution": "Banco de la República (BanRep)",
        "country": "CO",
        "series_id": "DF_TRM_DAILY_HIST",
        "docs_url": "https://suameca.banrep.gov.co/estadisticas-economicas/",
        "authority": "Banco de la República: autoridad cambiaria que define la TRM y su metodología",
        "certified_by": "Superintendencia Financiera de Colombia (calcula y certifica la TRM a diario)",
        "legal_basis": "Res. Externa 1 de 2018 JDBR, art. 40; Circular Reglamentaria DODM-146",
        "verified_against": {
          "provider": "sfc_trm",
          "institution": "Superintendencia Financiera de Colombia (portal de datos abiertos datos.gov.co)",
          "series_id": "32sa-8pi3",
          "docs_url": "https://dev.socrata.com/foundry/www.datos.gov.co/32sa-8pi3"
        },
        "fallback_used": false
      },
      "method": "official",
      "value": 3170.46,
      "date": "2026-10-15",
      "days_since_official": 0,
      "prev_value": 3197.65,
      "prev_date": "2026-10-14",
      "change_abs": -27.19,
      "change_pct": -0.8503,
      "status": "ok"
    },
    "usd_ars_a3500": {
      "pair": "USD-ARS",
      "label": "Dólar de referencia mayorista (Comunicación A 3500)",
      "quote_unit": "ARS por 1 USD",
      "date_basis": "determinacion",
      "primary": true,
      "decimals": 4,
      "source": {
        "provider": "bcra",
        "institution": "Banco Central de la República Argentina",
        "country": "AR",
        "series_id": "REF",
        "docs_url": "https://www.bcra.gob.ar/archivos/Catalogo/Content/files/pdf/estadisticascambiarias-v1.pdf"
      },
      "method": "official",
      "value": 1513.9308,
      "date": "2026-10-15",
      "days_since_official": 0,
      "prev_value": 1514.5655,
      "prev_date": "2026-10-14",
      "change_abs": -0.6347,
      "change_pct": -0.0419,
      "status": "ok"
    },
    "usd_brl_ptax": {
      "pair": "USD-BRL",
      "label": "PTAX de venta (cierre)",
      "quote_unit": "BRL por 1 USD",
      "date_basis": "determinacion",
      "primary": true,
      "decimals": 4,
      "source": {
        "provider": "bcb",
        "institution": "Banco Central do Brasil (BCB)",
        "country": "BR",
        "series_id": "CotacaoDolarPeriodo",
        "docs_url": "https://olinda.bcb.gov.br/olinda/servico/PTAX/versao/v1/documentacao",
        "authority": "Banco Central do Brasil: calcula y publica la PTAX",
        "legal_basis": "Resolução BCB nº 45/2020 (metodología PTAX; reemplazó la Circular 3.506/2010)"
      },
      "method": "official",
      "value": 5.0521,
      "date": "2026-10-15",
      "days_since_official": 0,
      "prev_value": 5.0441,
      "prev_date": "2026-10-14",
      "change_abs": 0.008,
      "change_pct": 0.1586,
      "status": "ok"
    },
    "usd_clp_obs": {
      "pair": "USD-CLP",
      "label": "Dólar observado (fecha de vigencia)",
      "quote_unit": "CLP por 1 USD",
      "date_basis": "vigencia",
      "primary": true,
      "decimals": 2,
      "source": {
        "provider": "bcch",
        "institution": "Banco Central de Chile (BCCh)",
        "country": "CL",
        "series_id": "F073.TCO.PRE.Z.D",
        "docs_url": "https://si3.bcentral.cl/estadisticas/Principal1/Web_Services/documentacion.html",
        "authority": "Banco Central de Chile: calcula y publica el dólar observado",
        "legal_basis": "Compendio de Normas de Cambios Internacionales, Capítulo I, sección VII"
      },
      "method": "official",
      "value": 987.03,
      "date": "2026-10-15",
      "days_since_official": 0,
      "prev_value": 980.79,
      "prev_date": "2026-10-14",
      "change_abs": 6.24,
      "change_pct": 0.6362,
      "next": {
        "date": "2026-10-16",
        "value": 984.09
      },
      "status": "ok"
    },
    "usd_clp_obs_mkt": {
      "pair": "USD-CLP",
      "label": "Dólar observado por fecha de mercado (insumo de las cruzadas)",
      "quote_unit": "CLP por 1 USD",
      "date_basis": "determinacion",
      "primary": false,
      "decimals": 2,
      "source": {
        "provider": "bcch",
        "institution": "Banco Central de Chile (BCCh)",
        "country": "CL",
        "series_id": "F073.TCO.PRE.Z.D",
        "docs_url": "https://si3.bcentral.cl/estadisticas/Principal1/Web_Services/documentacion.html",
        "authority": "Banco Central de Chile: calcula y publica el dólar observado",
        "legal_basis": "Compendio de Normas de Cambios Internacionales, Capítulo I, sección VII"
      },
      "method": "official",
      "value": 984.09,
      "date": "2026-10-15",
      "days_since_official": 0,
      "prev_value": 987.03,
      "prev_date": "2026-10-14",
      "change_abs": -2.94,
      "change_pct": -0.2979,
      "status": "ok"
    },
    "mxn_cop_cross": {
      "pair": "MXN-COP",
      "label": "Tasa cruzada MXN-COP vía USD (TRM ÷ FIX, mismo día de mercado)",
      "quote_unit": "COP por 1 MXN",
      "date_basis": "determinacion",
      "primary": true,
      "decimals": 4,
      "method": "cross_via_usd: usd_cop_trm_mkt / usd_mxn_fix",
      "inputs": [
        "usd_cop_trm_mkt",
        "usd_mxn_fix"
      ],
      "value": 172.0738,
      "date": "2026-10-15",
      "days_since_official": 0,
      "prev_value": 172.9507,
      "prev_date": "2026-10-14",
      "change_abs": -0.8769,
      "change_pct": -0.507,
      "status": "ok"
    },
    "mxn_ars_cross": {
      "pair": "MXN-ARS",
      "label": "Tasa cruzada MXN-ARS vía USD (A 3500 ÷ FIX, mismo día de mercado)",
      "quote_unit": "ARS por 1 MXN",
      "date_basis": "determinacion",
      "primary": true,
      "decimals": 4,
      "method": "cross_via_usd: usd_ars_a3500 / usd_mxn_fix",
      "inputs": [
        "usd_ars_a3500",
        "usd_mxn_fix"
      ],
      "value": 82.1672,
      "date": "2026-10-15",
      "days_since_official": 0,
      "prev_value": 81.918,
      "prev_date": "2026-10-14",
      "change_abs": 0.2492,
      "change_pct": 0.3042,
      "status": "ok"
    },
    "ars_cop_cross": {
      "pair": "ARS-COP",
      "label": "Tasa cruzada ARS-COP vía USD (TRM ÷ A 3500, mismo día de mercado)",
      "quote_unit": "COP por 1 ARS",
      "date_basis": "determinacion",
      "primary": true,
      "decimals": 4,
      "method": "cross_via_usd: usd_cop_trm_mkt / usd_ars_a3500",
      "inputs": [
        "usd_cop_trm_mkt",
        "usd_ars_a3500"
      ],
      "value": 2.0942,
      "date": "2026-10-15",
      "days_since_official": 0,
      "prev_value": 2.1113,
      "prev_date": "2026-10-14",
      "change_abs": -0.0171,
      "change_pct": -0.8099,
      "status": "ok"
    },